{
  "execution_id": "exec_20260921_m7_001",
  "session_id": "session_20260921_01",
  "output_dir": "/absolute/path/to/project/runs/exec_20260921_m7_001",
  "target": {
    "granularity": "single_image",
    "image_path": "/absolute/path/to/session_01/DJI_0042.JPG",
    "mime_type": "image/jpeg",
    "metadata": {
      "image_id": "DJI_0042",
      "resolution": [4000, 3000],
      "gps": {
        "lat": -1.2445,
        "lon": 116.8535
      },
      "altitude": 100.0,
      "timestamp": "2026-09-21T09:15:00Z",
      "gsd_m": 0.027,
      "rotation_deg": 0.0
    }
  },
  "aoi": {
    "type": "geojson_polygon",
    "geometry": {
      "type": "Polygon",
      "coordinates": [
        [
          [116.8523, -1.2435],
          [116.855, -1.2435],
          [116.855, -1.246],
          [116.8523, -1.246],
          [116.8523, -1.2435]
        ]
      ]
    }
  },
  "parameters": {
    "confidence_threshold": 0.5,
    "density_unit": "per_ha",
    "detector": "opencv_watershed",
    "iou_threshold": 0.5,
    "tile_size": 1024,
    "gsd_cm": 3.0
  }
}
