{
  "execution_id": "exec_20260914_001",
  "session_id": "session_20260914_01",
  "output_dir": "/absolute/path/to/project/runs/exec_20260914_001",

  "target": {
    "granularity": "single_image",
    "image_path": "/absolute/path/to/session_01/DJI_0042.JPG",
    "mime_type": "image/jpeg",
    "metadata": {
      "resolution": [4000, 3000],
      "gps": {
        "lat": -1.2435,
        "lon": 116.8523
      },
      "altitude": 120.5,
      "timestamp": "2026-09-14T10:30:00Z"
    }
  },

  "aoi": {
    "type": "geojson_polygon",
    "geometry": {
      "type": "Polygon",
      "coordinates": [
        [
          [116.8523, -1.2435],
          [116.855, -1.2435],
          [116.855, -1.246],
          [116.8523, -1.246],
          [116.8523, -1.2435]
        ]
      ]
    }
  },

  "parameters": {
    "example_select": "OPTION_A",
    "example_number": 0.5,
    "example_boolean": true
  }
}
